{
  "$id": "urn:capture-splat:schema:capture_splat.live_pairing_invitation.v0.1",
  "$schema": "https://json-schema.org/draft/2020-12/schema",
  "additionalProperties": false,
  "properties": {
    "authority": {
      "const": "proposal_only"
    },
    "desktop_id": {
      "$ref": "#/$defs/desktopId"
    },
    "desktop_name": {
      "maxLength": 80,
      "minLength": 1,
      "type": "string"
    },
    "desktop_public_key_b64u": {
      "$ref": "#/$defs/p256PublicKey"
    },
    "discovery": {
      "additionalProperties": false,
      "properties": {
        "domain": {
          "const": "local."
        },
        "service_name": {
          "maxLength": 63,
          "minLength": 1,
          "type": "string"
        },
        "service_type": {
          "const": "_capturesplat._tcp"
        }
      },
      "required": [
        "service_type",
        "service_name",
        "domain"
      ],
      "type": "object"
    },
    "expires_at": {
      "$ref": "#/$defs/timestamp"
    },
    "issued_at": {
      "$ref": "#/$defs/timestamp"
    },
    "mode": {
      "const": "qr"
    },
    "pairing_id": {
      "$ref": "#/$defs/pairingId"
    },
    "pairing_secret_b64u": {
      "$ref": "#/$defs/bytes32"
    },
    "permissions": {
      "$ref": "#/$defs/permissions"
    },
    "schema": {
      "const": "capture_splat.live_pairing_invitation.v0.1"
    },
    "tls_certificate_sha256": {
      "$ref": "#/$defs/sha256"
    }
  },
  "required": [
    "schema",
    "pairing_id",
    "mode",
    "desktop_id",
    "desktop_name",
    "desktop_public_key_b64u",
    "discovery",
    "tls_certificate_sha256",
    "pairing_secret_b64u",
    "issued_at",
    "expires_at",
    "permissions",
    "authority"
  ],
  "title": "Capture Splat live pairing invitation v0.1",
  "type": "object",
  "$defs": {
    "bytes32": {
      "pattern": "^[A-Za-z0-9_-]{42}[AEIMQUYcgkosw048]$",
      "type": "string"
    },
    "p256PublicKey": {
      "pattern": "^[A-Za-z0-9_-]{86}[AEIMQUYcgkosw048]$",
      "type": "string"
    },
    "pairingId": {
      "pattern": "^csp_[A-Za-z0-9_-]{21}[AQgw]$",
      "type": "string"
    },
    "desktopId": {
      "pattern": "^wsd_[A-Za-z0-9_-]{42}[AEIMQUYcgkosw048]$",
      "type": "string"
    },
    "permissions": {
      "items": {
        "enum": [
          "receiver:status",
          "session:create",
          "session:resume",
          "frame:put",
          "asset:put",
          "session:finalize"
        ]
      },
      "maxItems": 6,
      "minItems": 1,
      "type": "array",
      "uniqueItems": true
    },
    "sha256": {
      "pattern": "^sha256:[0-9a-f]{64}$",
      "type": "string"
    },
    "timestamp": {
      "pattern": "^(?!0000)\\d{4}-\\d{2}-\\d{2}T\\d{2}:\\d{2}:\\d{2}\\.\\d{3}Z$",
      "type": "string"
    }
  }
}
